{
  "contract": "coffee-codebook/1.0",
  "fromVersion": null,
  "toVersion": "6.0.0",
  "appendOnly": true,
  "startingIndexes": {
    "countries": 0,
    "regions": 0,
    "entities": 0,
    "varieties": 0,
    "processes": 0,
    "flavors": 0
  },
  "tables": {
    "countries": [
      [
        "CO-AO",
        "安哥拉",
        "Angola",
        "安哥拉",
        "active"
      ],
      [
        "CO-AU",
        "澳大利亚",
        "Australia",
        "澳洲",
        "active"
      ],
      [
        "CO-BO",
        "玻利维亚",
        "Bolivia",
        "玻利维亚",
        "active"
      ],
      [
        "CO-BR",
        "巴西",
        "Brazil",
        "巴西",
        "active"
      ],
      [
        "CO-BU",
        "布隆迪",
        "Burundi",
        "布隆迪",
        "active"
      ],
      [
        "CO-CD",
        "刚果（金）",
        "DR Congo",
        "刚果金",
        "active"
      ],
      [
        "CO-CF",
        "中非共和国",
        "Central African Republic",
        "中非",
        "active"
      ],
      [
        "CO-CG",
        "刚果（布）",
        "Republic of Congo",
        "刚果布",
        "active"
      ],
      [
        "CO-CI",
        "科特迪瓦",
        "Côte d’Ivoire / Ivory Coast",
        "科特迪瓦",
        "active"
      ],
      [
        "CO-CM",
        "喀麦隆",
        "Cameroon",
        "喀麦隆",
        "active"
      ],
      [
        "CO-CN",
        "中国",
        "China",
        "中国",
        "active"
      ],
      [
        "CO-CO",
        "哥伦比亚",
        "Colombia",
        "哥伦比亚",
        "active"
      ],
      [
        "CO-CR",
        "哥斯达黎加",
        "Costa Rica",
        "哥斯达",
        "active"
      ],
      [
        "CO-CU",
        "古巴",
        "Cuba",
        "古巴",
        "active"
      ],
      [
        "CO-DO",
        "多米尼加",
        "Dominican Republic",
        "多米尼加",
        "active"
      ],
      [
        "CO-EA",
        "埃塞俄比亚",
        "Ethiopia",
        "埃塞",
        "active"
      ],
      [
        "CO-EC",
        "厄瓜多尔",
        "Ecuador",
        "厄瓜多尔",
        "active"
      ],
      [
        "CO-ET",
        "东帝汶",
        "Timor-Leste",
        "东帝汶",
        "active"
      ],
      [
        "CO-GA",
        "加蓬",
        "Gabon",
        "加蓬",
        "active"
      ],
      [
        "CO-GH",
        "加纳",
        "Ghana",
        "加纳",
        "active"
      ],
      [
        "CO-GN",
        "几内亚",
        "Guinea",
        "几内亚",
        "active"
      ],
      [
        "CO-GT",
        "危地马拉",
        "Guatemala",
        "危地",
        "active"
      ],
      [
        "CO-HN",
        "洪都拉斯",
        "Honduras",
        "洪都拉斯",
        "active"
      ],
      [
        "CO-HT",
        "海地",
        "Haiti",
        "海地",
        "active"
      ],
      [
        "CO-ID",
        "印度尼西亚",
        "Indonesia",
        "印尼",
        "active"
      ],
      [
        "CO-IN",
        "印度",
        "India",
        "印度",
        "active"
      ],
      [
        "CO-JM",
        "牙买加",
        "Jamaica",
        "牙买加",
        "active"
      ],
      [
        "CO-KE",
        "肯尼亚",
        "Kenya",
        "肯尼亚",
        "active"
      ],
      [
        "CO-LA",
        "老挝",
        "Laos",
        "老挝",
        "active"
      ],
      [
        "CO-LR",
        "利比里亚",
        "Liberia",
        "利比里亚",
        "active"
      ],
      [
        "CO-MG",
        "马达加斯加",
        "Madagascar",
        "马达加斯加",
        "active"
      ],
      [
        "CO-MM",
        "缅甸",
        "Myanmar",
        "缅甸",
        "active"
      ],
      [
        "CO-MW",
        "马拉维",
        "Malawi",
        "马拉维",
        "active"
      ],
      [
        "CO-MX",
        "墨西哥",
        "Mexico",
        "墨西哥",
        "active"
      ],
      [
        "CO-MZ",
        "莫桑比克",
        "Mozambique",
        "莫桑比克",
        "active"
      ],
      [
        "CO-NG",
        "尼日利亚",
        "Nigeria",
        "尼日利亚",
        "active"
      ],
      [
        "CO-NI",
        "尼加拉瓜",
        "Nicaragua",
        "尼加拉瓜",
        "active"
      ],
      [
        "CO-NP",
        "尼泊尔",
        "Nepal",
        "尼泊尔",
        "active"
      ],
      [
        "CO-PA",
        "巴拿马",
        "Panama",
        "巴拿马",
        "active"
      ],
      [
        "CO-PE",
        "秘鲁",
        "Peru",
        "秘鲁",
        "active"
      ],
      [
        "CO-PG",
        "巴布亚新几内亚",
        "Papua New Guinea",
        "PNG",
        "active"
      ],
      [
        "CO-PH",
        "菲律宾",
        "Philippines",
        "菲律宾",
        "active"
      ],
      [
        "CO-PR",
        "波多黎各",
        "Puerto Rico",
        "波多黎各",
        "active"
      ],
      [
        "CO-RW",
        "卢旺达",
        "Rwanda",
        "卢旺达",
        "active"
      ],
      [
        "CO-SL",
        "塞拉利昂",
        "Sierra Leone",
        "塞拉利昂",
        "active"
      ],
      [
        "CO-SV",
        "萨尔瓦多",
        "El Salvador",
        "萨尔瓦多",
        "active"
      ],
      [
        "CO-TG",
        "多哥",
        "Togo",
        "多哥",
        "active"
      ],
      [
        "CO-TH",
        "泰国",
        "Thailand",
        "泰国",
        "active"
      ],
      [
        "CO-TZ",
        "坦桑尼亚",
        "Tanzania",
        "坦桑尼亚",
        "active"
      ],
      [
        "CO-UG",
        "乌干达",
        "Uganda",
        "乌干达",
        "active"
      ],
      [
        "CO-US",
        "美国夏威夷",
        "United States / Hawaii",
        "夏威夷",
        "active"
      ],
      [
        "CO-VE",
        "委内瑞拉",
        "Venezuela",
        "委内瑞拉",
        "active"
      ],
      [
        "CO-VN",
        "越南",
        "Vietnam",
        "越南",
        "active"
      ],
      [
        "CO-YE",
        "也门",
        "Yemen",
        "也门",
        "active"
      ],
      [
        "CO-ZM",
        "赞比亚",
        "Zambia",
        "赞比亚",
        "active"
      ],
      [
        "CO-ZW",
        "津巴布韦",
        "Zimbabwe",
        "津巴布韦",
        "active"
      ]
    ],
    "regions": [
      [
        "RG-AU-ATH",
        "CO-AU",
        "阿瑟顿高原",
        "Atherton Tablelands",
        "Atherton",
        "active"
      ],
      [
        "RG-BO-COP",
        "CO-BO",
        "科帕卡巴纳",
        "Copacabana",
        "Copacabana",
        "active"
      ],
      [
        "RG-BO-LAP",
        "CO-BO",
        "拉巴斯",
        "La Paz",
        "LaPaz",
        "active"
      ],
      [
        "RG-BO-YUN",
        "CO-BO",
        "永加斯",
        "Yungas",
        "Yungas",
        "active"
      ],
      [
        "RG-BR-BAH",
        "CO-BR",
        "巴伊亚",
        "Bahia",
        "Bahia",
        "active"
      ],
      [
        "RG-BR-CAM",
        "CO-BR",
        "坎普达斯韦尔滕特斯",
        "Campo das Vertentes",
        "Vertentes",
        "active"
      ],
      [
        "RG-BR-CAP",
        "CO-BR",
        "卡帕拉奥",
        "Caparao",
        "Caparao",
        "active"
      ],
      [
        "RG-BR-CER",
        "CO-BR",
        "塞拉多",
        "Cerrado Mineiro",
        "Cerrado",
        "active"
      ],
      [
        "RG-BR-CHA",
        "CO-BR",
        "帕拉纳高原",
        "Chapada Diamantina",
        "Chapada",
        "active"
      ],
      [
        "RG-BR-ESP",
        "CO-BR",
        "圣埃斯皮里图",
        "Espirito Santo",
        "Espirito",
        "active"
      ],
      [
        "RG-BR-MAN",
        "CO-BR",
        "曼蒂凯拉",
        "Mantiqueira de Minas",
        "Mantiqueira",
        "active"
      ],
      [
        "RG-BR-MAT",
        "CO-BR",
        "米纳斯森林",
        "Matas de Minas",
        "Matas",
        "active"
      ],
      [
        "RG-BR-MOG",
        "CO-BR",
        "摩吉安娜",
        "Mogiana",
        "Mogiana",
        "active"
      ],
      [
        "RG-BR-NPR",
        "CO-BR",
        "北先锋帕拉纳",
        "Norte Pioneiro do Parana",
        "NorteParana",
        "active"
      ],
      [
        "RG-BR-SP",
        "CO-BR",
        "圣保罗",
        "Sao Paulo",
        "SaoPaulo",
        "active"
      ],
      [
        "RG-BR-SUL",
        "CO-BR",
        "米纳斯南部",
        "Sul de Minas",
        "SulMinas",
        "active"
      ],
      [
        "RG-BU-KAR",
        "CO-BU",
        "卡鲁西",
        "Karusi",
        "Karusi",
        "active"
      ],
      [
        "RG-BU-KAY",
        "CO-BU",
        "卡扬扎",
        "Kayanza",
        "Kayanza",
        "active"
      ],
      [
        "RG-BU-KIR",
        "CO-BU",
        "基隆多",
        "Kirundo",
        "Kirundo",
        "active"
      ],
      [
        "RG-BU-MUR",
        "CO-BU",
        "穆拉姆维亚",
        "Muramvya",
        "Muramvya",
        "active"
      ],
      [
        "RG-BU-MUY",
        "CO-BU",
        "穆因加",
        "Muyinga",
        "Muyinga",
        "active"
      ],
      [
        "RG-BU-NGO",
        "CO-BU",
        "恩戈齐",
        "Ngozi",
        "Ngozi",
        "active"
      ],
      [
        "RG-CN-BAO",
        "CO-CN",
        "云南保山",
        "Baoshan, Yunnan",
        "保山",
        "active"
      ],
      [
        "RG-CN-DEH",
        "CO-CN",
        "云南德宏",
        "Dehong, Yunnan",
        "德宏",
        "active"
      ],
      [
        "RG-CN-JCH",
        "CO-CN",
        "云南江城",
        "Jiangcheng, Yunnan",
        "江城",
        "active"
      ],
      [
        "RG-CN-LAN",
        "CO-CN",
        "云南澜沧",
        "Lancang, Yunnan",
        "澜沧",
        "active"
      ],
      [
        "RG-CN-LIN",
        "CO-CN",
        "云南临沧",
        "Lincang, Yunnan",
        "临沧",
        "active"
      ],
      [
        "RG-CN-LJB",
        "CO-CN",
        "云南潞江坝",
        "Lujiangba, Yunnan",
        "潞江坝",
        "active"
      ],
      [
        "RG-CN-MEH",
        "CO-CN",
        "云南勐海",
        "Menghai, Yunnan",
        "勐海",
        "active"
      ],
      [
        "RG-CN-MEN",
        "CO-CN",
        "云南孟连",
        "Menglian, Yunnan",
        "孟连",
        "active"
      ],
      [
        "RG-CN-NUJ",
        "CO-CN",
        "云南怒江",